2026-01-30 12:40:50,538 - INFO - Logging to: logs\training_20260130_124050.log
2026-01-30 12:40:50,538 - INFO - Metrics logging to: logs\metrics_20260130_124050.csv
2026-01-30 12:40:50,538 - INFO - Using device: cuda
2026-01-30 12:40:50,538 - INFO - PyTorch version: 2.6.0+cu124
2026-01-30 12:40:50,553 - INFO - Normalization stats - LR max: 3.6391, HR max: 6.6261
2026-01-30 12:40:50,747 - INFO - Generator params: 1,441,878
2026-01-30 12:40:50,771 - INFO - Discriminator params: 4,693,697
2026-01-30 12:40:50,771 - INFO - Loading checkpoint from D:\SuperResolution\checkpoints\checkpoint_epoch_147.pt...
2026-01-30 12:40:51,748 - INFO - Loaded checkpoint from epoch 146
2026-01-30 12:40:51,748 - INFO - Previous Val MSE: 0.000104
2026-01-30 12:40:51,748 - INFO - Previous PSNR: 41.72 dB
2026-01-30 12:40:51,749 - INFO - Previous SSIM: 0.9281
2026-01-30 12:40:51,749 - INFO - Starting from epoch 147
2026-01-30 12:40:51,749 - INFO - ================================================================================
2026-01-30 12:40:51,749 - INFO - Compiling models with torch.compile (mode='reduce-overhead')...
2026-01-30 12:40:51,749 - INFO - This will provide good speedup without requiring Triton
2026-01-30 12:40:51,749 - INFO - ================================================================================
2026-01-30 12:40:53,189 - INFO - SUCCESS: Loaded optimizer states from checkpoint
2026-01-30 12:40:53,189 - INFO - Created all schedulers
2026-01-30 12:40:53,189 - INFO - Created data loaders
2026-01-30 12:40:53,189 - INFO - Checking data range...
2026-01-30 12:41:00,398 - INFO - LR: min=-0.1123, max=1.0000, mean=0.0012
2026-01-30 12:41:00,398 - INFO - HR: min=-0.2381, max=1.0000, mean=0.0007
2026-01-30 12:41:00,398 - INFO - 
Starting training for 200 epochs
2026-01-30 12:41:00,398 - INFO - Pretraining: 10 epochs
2026-01-30 12:41:00,398 - INFO - GAN training: 190 epochs
2026-01-30 12:41:00,398 - INFO - Starting from epoch 147
2026-01-30 12:51:46,222 - INFO - Saved checkpoint for epoch 148
2026-01-30 12:51:46,434 - INFO - Epoch 148 | G Loss: 0.0001 | D Loss: 0.0000 | lambda_adv: 0.000032 | Val MSE: 0.000104 | PSNR: 41.71 dB | SSIM: 0.9281 | G_LR: 1.79e-05 | D_LR: 3.60e-06
2026-01-30 12:59:56,310 - INFO - Saved checkpoint for epoch 149
2026-01-30 12:59:56,389 - INFO - Epoch 149 | G Loss: 0.0001 | D Loss: 0.0000 | lambda_adv: 0.000033 | Val MSE: 0.000105 | PSNR: 41.69 dB | SSIM: 0.9278 | G_LR: 1.73e-05 | D_LR: 3.47e-06
2026-01-30 13:07:54,263 - INFO - Saved checkpoint for epoch 150
2026-01-30 13:07:54,340 - INFO - Epoch 150 | G Loss: 0.0001 | D Loss: 0.0000 | lambda_adv: 0.000034 | Val MSE: 0.000105 | PSNR: 41.68 dB | SSIM: 0.9277 | G_LR: 1.66e-05 | D_LR: 1.00e-06
2026-01-30 13:14:21,542 - INFO - Saved checkpoint for epoch 151
2026-01-30 13:14:21,632 - INFO - Epoch 151 | G Loss: 0.0001 | D Loss: 0.0000 | lambda_adv: 0.000036 | Val MSE: 0.000105 | PSNR: 41.68 dB | SSIM: 0.9277 | G_LR: 1.60e-05 | D_LR: 9.68e-07
2026-01-30 13:20:50,598 - INFO - Saved checkpoint for epoch 152
2026-01-30 13:20:50,680 - INFO - Epoch 152 | G Loss: 0.0001 | D Loss: 0.0000 | lambda_adv: 0.000037 | Val MSE: 0.000105 | PSNR: 41.68 dB | SSIM: 0.9278 | G_LR: 1.54e-05 | D_LR: 9.32e-07
2026-01-30 13:27:19,747 - INFO - Saved checkpoint for epoch 153
2026-01-30 13:27:19,836 - INFO - Epoch 153 | G Loss: 0.0001 | D Loss: 0.0000 | lambda_adv: 0.000038 | Val MSE: 0.000105 | PSNR: 41.68 dB | SSIM: 0.9279 | G_LR: 1.48e-05 | D_LR: 8.96e-07
2026-01-30 13:33:46,544 - INFO - Saved checkpoint for epoch 154
2026-01-30 13:33:46,629 - INFO - Epoch 154 | G Loss: 0.0001 | D Loss: 0.0000 | lambda_adv: 0.000040 | Val MSE: 0.000104 | PSNR: 41.70 dB | SSIM: 0.9281 | G_LR: 1.42e-05 | D_LR: 8.61e-07
2026-01-30 13:41:01,667 - INFO - Saved checkpoint for epoch 155
2026-01-30 13:41:01,866 - INFO - New best model (SSIM: 0.9283)
2026-01-30 13:41:01,867 - INFO - Epoch 155 | G Loss: 0.0001 | D Loss: 0.0000 | lambda_adv: 0.000041 | Val MSE: 0.000104 | PSNR: 41.71 dB | SSIM: 0.9283 | G_LR: 1.37e-05 | D_LR: 8.27e-07
2026-01-30 13:47:32,077 - INFO - Saved checkpoint for epoch 156
2026-01-30 13:47:32,244 - INFO - New best model (SSIM: 0.9288)
2026-01-30 13:47:32,244 - INFO - Epoch 156 | G Loss: 0.0001 | D Loss: 0.0000 | lambda_adv: 0.000042 | Val MSE: 0.000103 | PSNR: 41.74 dB | SSIM: 0.9288 | G_LR: 1.31e-05 | D_LR: 7.93e-07
2026-01-30 13:53:57,974 - INFO - Saved checkpoint for epoch 157
2026-01-30 13:53:58,134 - INFO - New best model (SSIM: 0.9290)
2026-01-30 13:53:58,134 - INFO - Epoch 157 | G Loss: 0.0001 | D Loss: 0.0000 | lambda_adv: 0.000044 | Val MSE: 0.000103 | PSNR: 41.75 dB | SSIM: 0.9290 | G_LR: 1.25e-05 | D_LR: 7.60e-07
2026-01-30 14:02:39,726 - INFO - Saved checkpoint for epoch 158
2026-01-30 14:02:39,885 - INFO - New best model (SSIM: 0.9294)
2026-01-30 14:02:39,902 - INFO - Epoch 158 | G Loss: 0.0001 | D Loss: 0.0000 | lambda_adv: 0.000045 | Val MSE: 0.000103 | PSNR: 41.77 dB | SSIM: 0.9294 | G_LR: 1.20e-05 | D_LR: 7.27e-07
2026-01-30 14:09:38,870 - INFO - Saved checkpoint for epoch 159
2026-01-30 14:09:39,053 - INFO - New best model (SSIM: 0.9296)
2026-01-30 14:09:39,054 - INFO - Epoch 159 | G Loss: 0.0001 | D Loss: 0.0000 | lambda_adv: 0.000047 | Val MSE: 0.000102 | PSNR: 41.78 dB | SSIM: 0.9296 | G_LR: 1.15e-05 | D_LR: 6.95e-07
2026-01-30 14:16:06,493 - INFO - Saved checkpoint for epoch 160
2026-01-30 14:16:06,662 - INFO - New best model (SSIM: 0.9298)
2026-01-30 14:16:06,663 - INFO - Epoch 160 | G Loss: 0.0001 | D Loss: 0.0000 | lambda_adv: 0.000048 | Val MSE: 0.000102 | PSNR: 41.80 dB | SSIM: 0.9298 | G_LR: 1.10e-05 | D_LR: 6.63e-07
2026-01-30 14:22:33,233 - INFO - Saved checkpoint for epoch 161
2026-01-30 14:22:33,393 - INFO - New best model (SSIM: 0.9300)
2026-01-30 14:22:33,393 - INFO - Epoch 161 | G Loss: 0.0001 | D Loss: 0.0000 | lambda_adv: 0.000050 | Val MSE: 0.000102 | PSNR: 41.81 dB | SSIM: 0.9300 | G_LR: 1.04e-05 | D_LR: 6.33e-07
2026-01-30 14:28:56,605 - INFO - Saved checkpoint for epoch 162
2026-01-30 14:28:56,773 - INFO - New best model (SSIM: 0.9302)
2026-01-30 14:28:56,773 - INFO - Epoch 162 | G Loss: 0.0001 | D Loss: 0.0000 | lambda_adv: 0.000050 | Val MSE: 0.000102 | PSNR: 41.82 dB | SSIM: 0.9302 | G_LR: 9.94e-06 | D_LR: 6.02e-07
2026-01-30 14:35:16,397 - INFO - Saved checkpoint for epoch 163
2026-01-30 14:35:16,564 - INFO - New best model (SSIM: 0.9304)
2026-01-30 14:35:16,564 - INFO - Epoch 163 | G Loss: 0.0001 | D Loss: 0.0000 | lambda_adv: 0.000050 | Val MSE: 0.000101 | PSNR: 41.84 dB | SSIM: 0.9304 | G_LR: 9.45e-06 | D_LR: 5.73e-07
2026-01-30 14:41:42,991 - INFO - Saved checkpoint for epoch 164
2026-01-30 14:41:43,150 - INFO - New best model (SSIM: 0.9305)
2026-01-30 14:41:43,150 - INFO - Epoch 164 | G Loss: 0.0001 | D Loss: 0.0000 | lambda_adv: 0.000050 | Val MSE: 0.000101 | PSNR: 41.84 dB | SSIM: 0.9305 | G_LR: 8.98e-06 | D_LR: 5.44e-07
2026-01-30 14:48:08,364 - INFO - Saved checkpoint for epoch 165
2026-01-30 14:48:08,523 - INFO - New best model (SSIM: 0.9307)
2026-01-30 14:48:08,523 - INFO - Epoch 165 | G Loss: 0.0001 | D Loss: 0.0000 | lambda_adv: 0.000050 | Val MSE: 0.000101 | PSNR: 41.86 dB | SSIM: 0.9307 | G_LR: 8.51e-06 | D_LR: 5.16e-07
2026-01-30 14:54:34,618 - INFO - Saved checkpoint for epoch 166
2026-01-30 14:54:34,783 - INFO - New best model (SSIM: 0.9309)
2026-01-30 14:54:34,783 - INFO - Epoch 166 | G Loss: 0.0001 | D Loss: 0.0000 | lambda_adv: 0.000050 | Val MSE: 0.000100 | PSNR: 41.87 dB | SSIM: 0.9309 | G_LR: 8.06e-06 | D_LR: 4.89e-07
2026-01-30 15:01:01,736 - INFO - Saved checkpoint for epoch 167
2026-01-30 15:01:01,903 - INFO - New best model (SSIM: 0.9309)
2026-01-30 15:01:01,903 - INFO - Epoch 167 | G Loss: 0.0001 | D Loss: 0.0000 | lambda_adv: 0.000050 | Val MSE: 0.000100 | PSNR: 41.88 dB | SSIM: 0.9309 | G_LR: 7.62e-06 | D_LR: 4.62e-07
2026-01-30 15:07:30,037 - INFO - Saved checkpoint for epoch 168
2026-01-30 15:07:30,218 - INFO - New best model (SSIM: 0.9311)
2026-01-30 15:07:30,218 - INFO - Epoch 168 | G Loss: 0.0001 | D Loss: 0.0000 | lambda_adv: 0.000050 | Val MSE: 0.000100 | PSNR: 41.89 dB | SSIM: 0.9311 | G_LR: 7.19e-06 | D_LR: 4.36e-07
2026-01-30 15:13:56,347 - INFO - Saved checkpoint for epoch 169
2026-01-30 15:13:56,536 - INFO - New best model (SSIM: 0.9313)
2026-01-30 15:13:56,536 - INFO - Epoch 169 | G Loss: 0.0001 | D Loss: 0.0000 | lambda_adv: 0.000050 | Val MSE: 0.000100 | PSNR: 41.90 dB | SSIM: 0.9313 | G_LR: 6.77e-06 | D_LR: 4.10e-07
2026-01-30 15:20:25,532 - INFO - Saved checkpoint for epoch 170
2026-01-30 15:20:25,696 - INFO - New best model (SSIM: 0.9314)
2026-01-30 15:20:25,697 - INFO - Epoch 170 | G Loss: 0.0001 | D Loss: 0.0000 | lambda_adv: 0.000050 | Val MSE: 0.000099 | PSNR: 41.91 dB | SSIM: 0.9314 | G_LR: 6.36e-06 | D_LR: 3.86e-07
2026-01-30 15:27:15,769 - INFO - Saved checkpoint for epoch 171
2026-01-30 15:27:15,935 - INFO - New best model (SSIM: 0.9316)
2026-01-30 15:27:15,935 - INFO - Epoch 171 | G Loss: 0.0001 | D Loss: 0.0000 | lambda_adv: 0.000050 | Val MSE: 0.000099 | PSNR: 41.92 dB | SSIM: 0.9316 | G_LR: 5.97e-06 | D_LR: 3.62e-07
2026-01-30 15:35:30,708 - INFO - Saved checkpoint for epoch 172
2026-01-30 15:35:30,920 - INFO - New best model (SSIM: 0.9318)
2026-01-30 15:35:31,076 - INFO - Epoch 172 | G Loss: 0.0001 | D Loss: 0.0000 | lambda_adv: 0.000050 | Val MSE: 0.000099 | PSNR: 41.93 dB | SSIM: 0.9318 | G_LR: 5.58e-06 | D_LR: 3.38e-07
2026-01-30 15:42:20,817 - INFO - Saved checkpoint for epoch 173
2026-01-30 15:42:20,989 - INFO - New best model (SSIM: 0.9320)
2026-01-30 15:42:20,990 - INFO - Epoch 173 | G Loss: 0.0001 | D Loss: 0.0000 | lambda_adv: 0.000050 | Val MSE: 0.000099 | PSNR: 41.95 dB | SSIM: 0.9320 | G_LR: 5.21e-06 | D_LR: 3.16e-07
2026-01-30 15:48:38,969 - INFO - Saved checkpoint for epoch 174
2026-01-30 15:48:39,143 - INFO - New best model (SSIM: 0.9323)
2026-01-30 15:48:39,144 - INFO - Epoch 174 | G Loss: 0.0001 | D Loss: 0.0000 | lambda_adv: 0.000050 | Val MSE: 0.000098 | PSNR: 41.96 dB | SSIM: 0.9323 | G_LR: 4.85e-06 | D_LR: 2.94e-07
2026-01-30 15:58:09,159 - INFO - Saved checkpoint for epoch 175
2026-01-30 15:58:09,321 - INFO - New best model (SSIM: 0.9325)
2026-01-30 15:58:09,340 - INFO - Epoch 175 | G Loss: 0.0001 | D Loss: 0.0000 | lambda_adv: 0.000050 | Val MSE: 0.000098 | PSNR: 41.98 dB | SSIM: 0.9325 | G_LR: 4.50e-06 | D_LR: 2.73e-07
2026-01-30 16:06:11,407 - INFO - Saved checkpoint for epoch 176
2026-01-30 16:06:11,583 - INFO - New best model (SSIM: 0.9328)
2026-01-30 16:06:11,604 - INFO - Epoch 176 | G Loss: 0.0001 | D Loss: 0.0000 | lambda_adv: 0.000050 | Val MSE: 0.000098 | PSNR: 41.99 dB | SSIM: 0.9328 | G_LR: 4.17e-06 | D_LR: 2.53e-07
2026-01-30 16:15:53,143 - INFO - Saved checkpoint for epoch 177
2026-01-30 16:15:53,304 - INFO - New best model (SSIM: 0.9330)
2026-01-30 16:15:54,095 - INFO - Epoch 177 | G Loss: 0.0001 | D Loss: 0.0000 | lambda_adv: 0.000050 | Val MSE: 0.000097 | PSNR: 42.01 dB | SSIM: 0.9330 | G_LR: 3.85e-06 | D_LR: 2.33e-07
2026-01-30 16:25:37,190 - INFO - Saved checkpoint for epoch 178
2026-01-30 16:25:37,378 - INFO - New best model (SSIM: 0.9332)
2026-01-30 16:25:37,386 - INFO - Epoch 178 | G Loss: 0.0001 | D Loss: 0.0000 | lambda_adv: 0.000050 | Val MSE: 0.000097 | PSNR: 42.02 dB | SSIM: 0.9332 | G_LR: 3.54e-06 | D_LR: 2.14e-07
2026-01-30 16:29:55,054 - INFO - Saved checkpoint for epoch 179
2026-01-30 16:29:55,237 - INFO - New best model (SSIM: 0.9334)
2026-01-30 16:29:55,237 - INFO - Epoch 179 | G Loss: 0.0001 | D Loss: 0.0000 | lambda_adv: 0.000050 | Val MSE: 0.000097 | PSNR: 42.03 dB | SSIM: 0.9334 | G_LR: 3.24e-06 | D_LR: 1.96e-07
2026-01-30 16:37:24,863 - INFO - Saved checkpoint for epoch 180
2026-01-30 16:37:25,027 - INFO - New best model (SSIM: 0.9335)
2026-01-30 16:37:25,054 - INFO - Epoch 180 | G Loss: 0.0001 | D Loss: 0.0000 | lambda_adv: 0.000050 | Val MSE: 0.000097 | PSNR: 42.04 dB | SSIM: 0.9335 | G_LR: 2.95e-06 | D_LR: 1.79e-07
2026-01-30 16:41:35,630 - INFO - Saved checkpoint for epoch 181
2026-01-30 16:41:35,727 - INFO - Epoch 181 | G Loss: 0.0001 | D Loss: 0.0830 | lambda_adv: 0.000050 | Val MSE: 0.000128 | PSNR: 40.81 dB | SSIM: 0.9167 | G_LR: 2.68e-06 | D_LR: 5.42e-07
2026-01-30 16:45:47,722 - INFO - Saved checkpoint for epoch 182
2026-01-30 16:45:47,831 - INFO - Epoch 182 | G Loss: 0.0001 | D Loss: 0.1289 | lambda_adv: 0.000050 | Val MSE: 0.000135 | PSNR: 40.60 dB | SSIM: 0.9131 | G_LR: 2.42e-06 | D_LR: 4.89e-07
2026-01-30 16:50:04,170 - INFO - Saved checkpoint for epoch 183
2026-01-30 16:50:04,294 - INFO - Epoch 183 | G Loss: 0.0001 | D Loss: 0.1224 | lambda_adv: 0.000050 | Val MSE: 0.000139 | PSNR: 40.47 dB | SSIM: 0.9108 | G_LR: 2.18e-06 | D_LR: 6.59e-07
2026-01-30 16:54:19,860 - INFO - Saved checkpoint for epoch 184
2026-01-30 16:54:19,948 - INFO - Epoch 184 | G Loss: 0.0001 | D Loss: 0.1254 | lambda_adv: 0.000050 | Val MSE: 0.000133 | PSNR: 40.64 dB | SSIM: 0.9135 | G_LR: 1.94e-06 | D_LR: 5.89e-07
2026-01-30 16:58:35,356 - INFO - Saved checkpoint for epoch 185
2026-01-30 16:58:35,450 - INFO - Epoch 185 | G Loss: 0.0001 | D Loss: 0.1200 | lambda_adv: 0.000050 | Val MSE: 0.000139 | PSNR: 40.46 dB | SSIM: 0.9107 | G_LR: 1.72e-06 | D_LR: 5.22e-07
2026-01-30 17:02:50,721 - INFO - Saved checkpoint for epoch 186
2026-01-30 17:02:51,098 - INFO - Epoch 186 | G Loss: 0.0001 | D Loss: 0.1084 | lambda_adv: 0.000050 | Val MSE: 0.000139 | PSNR: 40.46 dB | SSIM: 0.9109 | G_LR: 1.51e-06 | D_LR: 4.59e-07
2026-01-30 17:07:06,914 - INFO - Saved checkpoint for epoch 187
2026-01-30 17:07:07,072 - INFO - Epoch 187 | G Loss: 0.0001 | D Loss: 0.1096 | lambda_adv: 0.000050 | Val MSE: 0.000136 | PSNR: 40.55 dB | SSIM: 0.9118 | G_LR: 1.32e-06 | D_LR: 4.00e-07
2026-01-30 17:11:22,988 - INFO - Saved checkpoint for epoch 188
2026-01-30 17:11:23,104 - INFO - Epoch 188 | G Loss: 0.0001 | D Loss: 0.1037 | lambda_adv: 0.000050 | Val MSE: 0.000132 | PSNR: 40.67 dB | SSIM: 0.9141 | G_LR: 1.14e-06 | D_LR: 3.45e-07
2026-01-30 17:15:39,340 - INFO - Saved checkpoint for epoch 189
2026-01-30 17:15:39,436 - INFO - Epoch 189 | G Loss: 0.0001 | D Loss: 0.0982 | lambda_adv: 0.000050 | Val MSE: 0.000141 | PSNR: 40.41 dB | SSIM: 0.9108 | G_LR: 9.71e-07 | D_LR: 2.94e-07
2026-01-30 17:19:52,257 - INFO - Saved checkpoint for epoch 190
2026-01-30 17:19:52,365 - INFO - Epoch 190 | G Loss: 0.0001 | D Loss: 0.1019 | lambda_adv: 0.000050 | Val MSE: 0.000140 | PSNR: 40.42 dB | SSIM: 0.9088 | G_LR: 8.17e-07 | D_LR: 2.47e-07
2026-01-30 17:24:05,770 - INFO - Saved checkpoint for epoch 191
2026-01-30 17:24:05,854 - INFO - Epoch 191 | G Loss: 0.0001 | D Loss: 0.1003 | lambda_adv: 0.000050 | Val MSE: 0.000140 | PSNR: 40.43 dB | SSIM: 0.9087 | G_LR: 6.75e-07 | D_LR: 2.05e-07
2026-01-30 17:28:19,156 - INFO - Saved checkpoint for epoch 192
2026-01-30 17:28:19,516 - INFO - Epoch 192 | G Loss: 0.0001 | D Loss: 0.1034 | lambda_adv: 0.000050 | Val MSE: 0.000141 | PSNR: 40.41 dB | SSIM: 0.9093 | G_LR: 5.47e-07 | D_LR: 1.66e-07
2026-01-30 17:32:32,745 - INFO - Saved checkpoint for epoch 193
2026-01-30 17:32:32,831 - INFO - Epoch 193 | G Loss: 0.0001 | D Loss: 0.1005 | lambda_adv: 0.000050 | Val MSE: 0.000141 | PSNR: 40.39 dB | SSIM: 0.9093 | G_LR: 4.32e-07 | D_LR: 1.31e-07
2026-01-30 17:36:44,639 - INFO - Saved checkpoint for epoch 194
2026-01-30 17:36:44,727 - INFO - Epoch 194 | G Loss: 0.0001 | D Loss: 0.1027 | lambda_adv: 0.000050 | Val MSE: 0.000142 | PSNR: 40.37 dB | SSIM: 0.9086 | G_LR: 3.31e-07 | D_LR: 1.00e-07
2026-01-30 17:40:56,852 - INFO - Saved checkpoint for epoch 195
2026-01-30 17:40:56,940 - INFO - Epoch 195 | G Loss: 0.0001 | D Loss: 0.1057 | lambda_adv: 0.000050 | Val MSE: 0.000142 | PSNR: 40.38 dB | SSIM: 0.9086 | G_LR: 2.43e-07 | D_LR: 1.00e-07
2026-01-30 17:45:08,823 - INFO - Saved checkpoint for epoch 196
2026-01-30 17:45:08,919 - INFO - Epoch 196 | G Loss: 0.0001 | D Loss: 0.1073 | lambda_adv: 0.000050 | Val MSE: 0.000142 | PSNR: 40.36 dB | SSIM: 0.9083 | G_LR: 1.69e-07 | D_LR: 1.00e-07
2026-01-30 17:49:20,458 - INFO - Saved checkpoint for epoch 197
2026-01-30 17:49:20,546 - INFO - Epoch 197 | G Loss: 0.0001 | D Loss: 0.1066 | lambda_adv: 0.000050 | Val MSE: 0.000143 | PSNR: 40.34 dB | SSIM: 0.9077 | G_LR: 1.08e-07 | D_LR: 1.00e-07
2026-01-30 17:53:32,607 - INFO - Saved checkpoint for epoch 198
2026-01-30 17:53:32,723 - INFO - Epoch 198 | G Loss: 0.0001 | D Loss: 0.1055 | lambda_adv: 0.000050 | Val MSE: 0.000143 | PSNR: 40.33 dB | SSIM: 0.9075 | G_LR: 1.00e-07 | D_LR: 1.00e-07
2026-01-30 17:57:44,825 - INFO - Saved checkpoint for epoch 199
2026-01-30 17:57:44,899 - INFO - Epoch 199 | G Loss: 0.0001 | D Loss: 0.0979 | lambda_adv: 0.000050 | Val MSE: 0.000143 | PSNR: 40.33 dB | SSIM: 0.9079 | G_LR: 1.00e-07 | D_LR: 1.00e-07
2026-01-30 18:01:57,013 - INFO - Saved checkpoint for epoch 200
2026-01-30 18:01:57,112 - INFO - Epoch 200 | G Loss: 0.0001 | D Loss: 0.0901 | lambda_adv: 0.000050 | Val MSE: 0.000142 | PSNR: 40.36 dB | SSIM: 0.9085 | G_LR: 1.00e-07 | D_LR: 1.00e-07
2026-01-30 18:01:57,112 - INFO - 
================================================================================
2026-01-30 18:01:57,112 - INFO - Training completed!
2026-01-30 18:01:57,113 - INFO - Best validation MSE: 0.000104
2026-01-30 18:01:57,113 - INFO - Best validation SSIM: 0.9335
2026-01-30 18:01:57,113 - INFO - Checkpoints: checkpoints/
2026-01-30 18:01:57,114 - INFO - Logs: logs\training_20260130_124050.log
2026-01-30 18:01:57,114 - INFO - Metrics: logs\metrics_20260130_124050.csv
2026-01-30 18:01:57,114 - INFO - ================================================================================
